{
  "spec": "DAE_P1_Free_v1",
  "episode_id": "ep-ed57a71e878b",
  "episode_start": "2026-01-16T06:26:46Z",
  "worst_window_ref": "Wl:1768544760",
  "primary_verdict": "OPAQUE_RISK",
  "confidence": 0.7,
  "evidence_refs": [
    "Ws:1768544800:no_flags"
  ],
  "observability": {
    "observability_status": "INSUFFICIENT",
    "opaque_risk": true,
    "missing_refs": [
      "no_change_event_detected"
    ],
    "origin_hint": "unknown"
  },
  "timeline": {
    "metrics_points": [
      {
        "t": "2026-01-16T06:22:28Z",
        "window_ref": "Ws:1768544540",
        "latency_p95_ms": 5.0,
        "loss_pct": null,
        "retry_pct": 0.0,
        "airtime_busy_pct": 0.0,
        "mesh_flap_count": null,
        "wan_sinr_db": null
      },
      {
        "t": "2026-01-16T06:22:30Z",
        "window_ref": "Ws:1768544550",
        "latency_p95_ms": 4.0,
        "loss_pct": null,
        "retry_pct": 0.0,
        "airtime_busy_pct": 0.0,
        "mesh_flap_count": null,
        "wan_sinr_db": null
      },
      {
        "t": "2026-01-16T06:22:33Z",
        "window_ref": "Ws:1768544550",
        "latency_p95_ms": 4.0,
        "loss_pct": null,
        "retry_pct": 0.0,
        "airtime_busy_pct": 0.0,
        "mesh_flap_count": null,
        "wan_sinr_db": null
      },
      {
        "t": "2026-01-16T06:22:35Z",
        "window_ref": "Ws:1768544550",
        "latency_p95_ms": 4.5,
        "loss_pct": null,
        "retry_pct": 0.0,
        "airtime_busy_pct": 0.0,
        "mesh_flap_count": null,
        "wan_sinr_db": null
      },
      {
        "t": "2026-01-16T06:22:37Z",
        "window_ref": "Ws:1768544550",
        "latency_p95_ms": 5.0,
        "loss_pct": null,
        "retry_pct": 0.0,
        "airtime_busy_pct": 0.0,
        "mesh_flap_count": null,
        "wan_sinr_db": null
      },
      {
        "t": "2026-01-16T06:22:39Z",
        "window_ref": "Ws:1768544550",
        "latency_p95_ms": 4.0,
        "loss_pct": null,
        "retry_pct": 0.0,
        "airtime_busy_pct": 0.0,
        "mesh_flap_count": null,
        "wan_sinr_db": null
      },
      {
        "t": "2026-01-16T06:22:42Z",
        "window_ref": "Ws:1768544560",
        "latency_p95_ms": 4.5,
        "loss_pct": null,
        "retry_pct": 0.0,
        "airtime_busy_pct": 0.0,
        "mesh_flap_count": null,
        "wan_sinr_db": null
      },
      {
        "t": "2026-01-16T06:22:44Z",
        "window_ref": "Ws:1768544560",
        "latency_p95_ms": 4.0,
        "loss_pct": null,
        "retry_pct": 0.0,
        "airtime_busy_pct": 0.0,
        "mesh_flap_count": null,
        "wan_sinr_db": null
      },
      {
        "t": "2026-01-16T06:22:46Z",
        "window_ref": "Ws:1768544560",
        "latency_p95_ms": 10.0,
        "loss_pct": null,
        "retry_pct": 0.0,
        "airtime_busy_pct": 0.0,
        "mesh_flap_count": null,
        "wan_sinr_db": null
      },
      {
        "t": "2026-01-16T06:22:48Z",
        "window_ref": "Ws:1768544560",
        "latency_p95_ms": 6.0,
        "loss_pct": null,
        "retry_pct": 0.0,
        "airtime_busy_pct": 0.0,
        "mesh_flap_count": null,
        "wan_sinr_db": null
      },
      {
        "t": "2026-01-16T06:22:50Z",
        "window_ref": "Ws:1768544570",
        "latency_p95_ms": 4.5,
        "loss_pct": null,
        "retry_pct": 0.0,
        "airtime_busy_pct": 0.0,
        "mesh_flap_count": null,
        "wan_sinr_db": null
      },
      {
        "t": "2026-01-16T06:22:53Z",
        "window_ref": "Ws:1768544570",
        "latency_p95_ms": 5.0,
        "loss_pct": null,
        "retry_pct": 0.0,
        "airtime_busy_pct": 0.0,
        "mesh_flap_count": null,
        "wan_sinr_db": null
      },
      {
        "t": "2026-01-16T06:22:55Z",
        "window_ref": "Ws:1768544570",
        "latency_p95_ms": 6.0,
        "loss_pct": null,
        "retry_pct": 0.0,
        "airtime_busy_pct": 0.0,
        "mesh_flap_count": null,
        "wan_sinr_db": null
      },
      {
        "t": "2026-01-16T06:22:57Z",
        "window_ref": "Ws:1768544570",
        "latency_p95_ms": 5.5,
        "loss_pct": null,
        "retry_pct": 0.0,
        "airtime_busy_pct": 0.0,
        "mesh_flap_count": null,
        "wan_sinr_db": null
      },
      {
        "t": "2026-01-16T06:22:59Z",
        "window_ref": "Ws:1768544570",
        "latency_p95_ms": 5.0,
        "loss_pct": null,
        "retry_pct": 0.0,
        "airtime_busy_pct": 0.0,
        "mesh_flap_count": null,
        "wan_sinr_db": null
      },
      {
        "t": "2026-01-16T06:23:02Z",
        "window_ref": "Ws:1768544580",
        "latency_p95_ms": 4.0,
        "loss_pct": null,
        "retry_pct": 0.0,
        "airtime_busy_pct": 0.0,
        "mesh_flap_count": null,
        "wan_sinr_db": null
      },
      {
        "t": "2026-01-16T06:23:04Z",
        "window_ref": "Ws:1768544580",
        "latency_p95_ms": 4.5,
        "loss_pct": null,
        "retry_pct": 0.0,
        "airtime_busy_pct": 0.0,
        "mesh_flap_count": null,
        "wan_sinr_db": null
      },
      {
        "t": "2026-01-16T06:23:06Z",
        "window_ref": "Ws:1768544580",
        "latency_p95_ms": 5.0,
        "loss_pct": null,
        "retry_pct": 0.0,
        "airtime_busy_pct": 0.0,
        "mesh_flap_count": null,
        "wan_sinr_db": null
      },
      {
        "t": "2026-01-16T06:23:08Z",
        "window_ref": "Ws:1768544580",
        "latency_p95_ms": 4.5,
        "loss_pct": null,
        "retry_pct": 0.0,
        "airtime_busy_pct": 0.0,
        "mesh_flap_count": null,
        "wan_sinr_db": null
      },
      {
        "t": "2026-01-16T06:23:10Z",
        "window_ref": "Ws:1768544590",
        "latency_p95_ms": 4.5,
        "loss_pct": null,
        "retry_pct": 0.0,
        "airtime_busy_pct": 0.0,
        "mesh_flap_count": null,
        "wan_sinr_db": null
      },
      {
        "t": "2026-01-16T06:23:13Z",
        "window_ref": "Ws:1768544590",
        "latency_p95_ms": 6.0,
        "loss_pct": null,
        "retry_pct": 0.0,
        "airtime_busy_pct": 0.0,
        "mesh_flap_count": null,
        "wan_sinr_db": null
      },
      {
        "t": "2026-01-16T06:23:15Z",
        "window_ref": "Ws:1768544590",
        "latency_p95_ms": 4.0,
        "loss_pct": null,
        "retry_pct": 0.0,
        "airtime_busy_pct": 0.0,
        "mesh_flap_count": null,
        "wan_sinr_db": null
      },
      {
        "t": "2026-01-16T06:23:17Z",
        "window_ref": "Ws:1768544590",
        "latency_p95_ms": 5.5,
        "loss_pct": null,
        "retry_pct": 0.0,
        "airtime_busy_pct": 0.0,
        "mesh_flap_count": null,
        "wan_sinr_db": null
      },
      {
        "t": "2026-01-16T06:23:19Z",
        "window_ref": "Ws:1768544590",
        "latency_p95_ms": 4.5,
        "loss_pct": null,
        "retry_pct": 0.0,
        "airtime_busy_pct": 0.0,
        "mesh_flap_count": null,
        "wan_sinr_db": null
      },
      {
        "t": "2026-01-16T06:23:21Z",
        "window_ref": "Ws:1768544600",
        "latency_p95_ms": 4.0,
        "loss_pct": null,
        "retry_pct": 0.0,
        "airtime_busy_pct": 0.0,
        "mesh_flap_count": null,
        "wan_sinr_db": null
      },
      {
        "t": "2026-01-16T06:23:24Z",
        "window_ref": "Ws:1768544600",
        "latency_p95_ms": 5.0,
        "loss_pct": null,
        "retry_pct": 0.0,
        "airtime_busy_pct": 0.0,
        "mesh_flap_count": null,
        "wan_sinr_db": null
      },
      {
        "t": "2026-01-16T06:23:26Z",
        "window_ref": "Ws:1768544600",
        "latency_p95_ms": 4.5,
        "loss_pct": null,
        "retry_pct": 0.0,
        "airtime_busy_pct": 0.0,
        "mesh_flap_count": null,
        "wan_sinr_db": null
      },
      {
        "t": "2026-01-16T06:23:28Z",
        "window_ref": "Ws:1768544600",
        "latency_p95_ms": 13.0,
        "loss_pct": null,
        "retry_pct": 0.0,
        "airtime_busy_pct": 0.0,
        "mesh_flap_count": null,
        "wan_sinr_db": null
      },
      {
        "t": "2026-01-16T06:23:30Z",
        "window_ref": "Ws:1768544610",
        "latency_p95_ms": 4.5,
        "loss_pct": null,
        "retry_pct": 0.0,
        "airtime_busy_pct": 0.0,
        "mesh_flap_count": null,
        "wan_sinr_db": null
      },
      {
        "t": "2026-01-16T06:23:32Z",
        "window_ref": "Ws:1768544610",
        "latency_p95_ms": 4.0,
        "loss_pct": null,
        "retry_pct": 0.0,
        "airtime_busy_pct": 0.0,
        "mesh_flap_count": null,
        "wan_sinr_db": null
      },
      {
        "t": "2026-01-16T06:23:35Z",
        "window_ref": "Ws:1768544610",
        "latency_p95_ms": 5.5,
        "loss_pct": null,
        "retry_pct": 0.0,
        "airtime_busy_pct": 0.0,
        "mesh_flap_count": null,
        "wan_sinr_db": null
      },
      {
        "t": "2026-01-16T06:23:37Z",
        "window_ref": "Ws:1768544610",
        "latency_p95_ms": 5.5,
        "loss_pct": null,
        "retry_pct": 0.0,
        "airtime_busy_pct": 0.0,
        "mesh_flap_count": null,
        "wan_sinr_db": null
      },
      {
        "t": "2026-01-16T06:23:39Z",
        "window_ref": "Ws:1768544610",
        "latency_p95_ms": 4.0,
        "loss_pct": null,
        "retry_pct": 0.0,
        "airtime_busy_pct": 0.0,
        "mesh_flap_count": null,
        "wan_sinr_db": null
      },
      {
        "t": "2026-01-16T06:23:41Z",
        "window_ref": "Ws:1768544620",
        "latency_p95_ms": 4.5,
        "loss_pct": null,
        "retry_pct": 0.0,
        "airtime_busy_pct": 0.0,
        "mesh_flap_count": null,
        "wan_sinr_db": null
      },
      {
        "t": "2026-01-16T06:23:43Z",
        "window_ref": "Ws:1768544620",
        "latency_p95_ms": 4.0,
        "loss_pct": null,
        "retry_pct": 0.0,
        "airtime_busy_pct": 0.0,
        "mesh_flap_count": null,
        "wan_sinr_db": null
      },
      {
        "t": "2026-01-16T06:23:46Z",